665,/mnt/data/guest0/uchan/DATA/About Time,2,2,1,2,2,"At the age of 21, Tim discovers he can travel in time and change what happens and has happened in his own life. His decision to make his world a better place by getting a girlfriend turns out not to be as easy as you might think."
1615,/mnt/data/guest0/uchan/DATA/Baby Driver,0,1,3,2,1,"After being coerced into working for a crime boss, a young getaway driver finds himself taking part in a heist doomed to fail."
914,/mnt/data/guest0/uchan/DATA/The Lost Boys,2,1,2,2,1,"After moving to a new town, two brothers discover that the area is a haven for vampires."
2831,/mnt/data/guest0/uchan/DATA/Magnum P.I,0,2,0,2,2,An ex-Navy SEAL returns from Afghanistan and uses his military skills to become a private investigator in Hawaii.
2225,/mnt/data/guest0/uchan/DATA/Yesterday,2,2,2,2,0,A struggling musician realizes he's the only person on Earth who can remember The Beatles after waking up in an alternate timeline where they never existed.
1781,/mnt/data/guest0/uchan/DATA/War Dogs,2,1,3,3,2,"Loosely based on the true story of two young men, David Packouz and Efraim Diveroli, who won a three hundred million dollar contract from the Pentagon to arm America's allies in Afghanistan."
1613,/mnt/data/guest0/uchan/DATA/The Temptation More Beautiful Than a Love,1,2,1,1,0,Two vicious step-siblings of an elite Manhattan prep school make a wager: to deflower the new headmaster's daughter before the start of term.
1667,/mnt/data/guest0/uchan/DATA/Aquaman,0,1,2,2,2,"Arthur Curry, the human-born heir to the underwater kingdom of Atlantis, goes on a quest to prevent a war between the worlds of ocean and land."
1722,/mnt/data/guest0/uchan/DATA/Hellboy,2,3,1,1,3,"Based on the graphic novels by Mike Mignola, Hellboy, caught between the worlds of the supernatural and human, battles an ancient sorceress bent on revenge."
1290,/mnt/data/guest0/uchan/DATA/Medici,1,2,2,2,2,"A political family drama set in Florence in the early fifteenth century. Cosimo de Medici finds himself at the helm of his banking dynasty when his father, Giovanni, dies suddenly."
1338,/mnt/data/guest0/uchan/DATA/Dazed and Confused,2,2,3,1,0,The adventures of high school and junior high students on the last day of school in May 1976.
981,/mnt/data/guest0/uchan/DATA/Star Trek Deep Space Nine,2,1,2,2,1,"In the vicinity of the liberated planet of Bajor, the Federation space station Deep Space Nine guards the opening of a stable wormhole to the far side of the galaxy."
183,/mnt/data/guest0/uchan/DATA/Grey's Anatomy,1,3,2,1,1,A drama centered on the personal and professional lives of five surgical interns and their supervisors.
1194,/mnt/data/guest0/uchan/DATA/Orphan Black,1,3,1,1,1,A streetwise hustler is pulled into a compelling conspiracy after witnessing the suicide of a girl who looks just like her.
1157,/mnt/data/guest0/uchan/DATA/An American Werewolf in London,1,3,1,2,3,Two American college students on a walking tour of Britain are attacked by a werewolf that none of the locals will admit exists.
974,/mnt/data/guest0/uchan/DATA/The Fifth Element,1,2,2,2,2,"In the colorful future, a cab driver unwittingly becomes the central figure in the search for a legendary cosmic weapon to keep Evil and Mr. Zorg at bay."
301,/mnt/data/guest0/uchan/DATA/Legacies,2,1,2,2,2,"Hope Mikaelson, a tribrid daughter of a Vampire/Werewolf hybrid, makes her way in the world."
327,/mnt/data/guest0/uchan/DATA/The Goldbergs,2,0,2,2,0,"This ABC show takes place in Jenkintown, Pennsylvania in the 1980s and follows the lives of a family named The Goldbergs."
1015,/mnt/data/guest0/uchan/DATA/Kôdo giasu - Hangyaku no rurûshu Code Geass - Lelouch of the Rebellion,1,1,2,2,3,"After being given a mysterious power to control others, an outcast prince becomes the masked leader of the rebellion against an all powerful empire"
303,/mnt/data/guest0/uchan/DATA/WandaVision,0,2,0,2,2,"Blends the style of classic sitcoms with the MCU, in which Wanda Maximoff and Vision - two super-powered beings living their ideal suburban lives - begin to suspect that everything is not as it seems."
771,/mnt/data/guest0/uchan/DATA/A Quiet Place,0,1,0,0,3,"In a post-apocalyptic world, a family is forced to live in silence while hiding from monsters with ultra-sensitive hearing."
1544,/mnt/data/guest0/uchan/DATA/Star Trek The Next Generation,2,2,2,2,1,"Set almost 100 years after Captain Kirk's five-year mission, a new generation of Starfleet officers set off in the U.S.S. Enterprise-D on their own mission to go where no one has gone before."
761,/mnt/data/guest0/uchan/DATA/Milakyulleoseu Leidibeogeuwa Beullaegkaes,0,2,0,0,0,"Marinette and Adrien, two normal teens, transform into superheroes Ladybug and Cat Noir when an evil threatens their city."
1673,/mnt/data/guest0/uchan/DATA/The Mule,1,2,1,1,2,A ninety-year-old horticulturist and Korean War veteran turns drug mule for a Mexican cartel.
1248,/mnt/data/guest0/uchan/DATA/Wet Hot American Summer,2,0,1,1,0,"Set on the last day of camp, in the hot summer of 1981, a group of counselors try to complete their unfinished business before the day ends."
304,/mnt/data/guest0/uchan/DATA/Death in Paradise,0,2,2,2,2,"A UK police DI is transferred to St-Marie to investigate murders on the island, but he hates the sun, sea, and sand. Later series see other English and Irish detectives take over the role."
319,/mnt/data/guest0/uchan/DATA/As Good as It Gets,2,2,1,2,2,"A single mother and waitress, a misanthropic author, and a gay artist form an unlikely friendship after the artist is assaulted in a robbery."
1196,/mnt/data/guest0/uchan/DATA/Inception,0,1,2,2,1,A thief who steals corporate secrets through the use of dream-sharing technology is given the inverse task of planting an idea into the mind of a C.E.O.
1761,/mnt/data/guest0/uchan/DATA/Moxie,2,0,2,2,0,"Inspired by her mom's rebellious past and a confident new friend, a shy 16-year-old publishes an anonymous zine calling out sexism at her school."
740,/mnt/data/guest0/uchan/DATA/Nomadland,2,0,2,2,0,"After losing everything in the Great Recession, a woman embarks on a journey through the American West, living as a van-dwelling modern-day nomad."
1227,/mnt/data/guest0/uchan/DATA/The Favourite,1,2,1,2,2,"In early 18th-century England, the status quo at the court is upset when a new servant arrives and endears herself to a frail Queen Anne."
940,/mnt/data/guest0/uchan/DATA/Freaky,2,3,3,2,1,"After swapping bodies with a deranged serial killer, a young girl in high school discovers she has less than 24 hours before the change becomes permanent."
184,/mnt/data/guest0/uchan/DATA/Justified,2,3,1,1,1,"U.S. Marshal Raylan Givens is reassigned from Miami to his childhood home in the poor, rural coal mining towns of eastern Kentucky."
303,/mnt/data/guest0/uchan/DATA/The Big Bang Theory,2,0,2,2,0,A woman who moves into an apartment across the hall from two brilliant but socially awkward physicists shows them how little they know about life outside of the laboratory.
1088,/mnt/data/guest0/uchan/DATA/Hunter x Hunter,2,1,2,2,3,"Gon Freecss aspires to become a Hunter, an exceptional being capable of greatness. With his friends and his potential, he seeks for his father who left him when he was younger."
1495,/mnt/data/guest0/uchan/DATA/The Princess Diaries,2,0,0,0,0,"Mia Thermopolis has just found out that she is the heir apparent to the throne of Genovia. With her friends Lilly and Michael Moscovitz in tow, she tries to navigate through the rest of her sixteenth year."
1438,/mnt/data/guest0/uchan/DATA/The Big Short,1,0,3,2,2,In 2006-2007 a group of investors bet against the US mortgage market. In their research they discover how flawed and corrupt the market is.
1877,/mnt/data/guest0/uchan/DATA/Jumanji,0,2,2,2,1,"When two kids find and play a magical board game, they release a man trapped in it for decades - and a host of dangers that can only be stopped by finishing the game."
1720,/mnt/data/guest0/uchan/DATA/The Art of Self-Defense,1,1,1,2,1,"After being attacked on the street, a young man enlists at a local dojo, led by a charismatic and mysterious sensei, in an effort to learn how to defend himself from future threats."
1757,/mnt/data/guest0/uchan/DATA/The Princess and the Frog,0,2,0,2,1,"A waitress, desperate to fulfill her dreams as a restaurant owner, is set on a journey to turn a frog prince back into a human being, but she has to face the same problem after she kisses him."
1655,/mnt/data/guest0/uchan/DATA/Nightcrawler,0,1,3,2,1,"When Louis Bloom, a con man desperate for work, muscles into the world of L.A. crime journalism, he blurs the line between observer and participant to become the star of his own story."
315,/mnt/data/guest0/uchan/DATA/The Tudors,3,3,1,2,1,A dramatic series about the reign and marriages of King Henry VIII.
1769,/mnt/data/guest0/uchan/DATA/Geu-nyeo,1,0,3,2,0,"In a near future, a lonely writer develops an unlikely relationship with an operating system designed to meet his every need."
304,"/mnt/data/guest0/uchan/DATA/Lock, Stock and Two Smoking Barrels",1,3,3,1,2,"Eddy persuades his three pals to pool money for a vital poker game against a powerful local mobster, Hatchet Harry. Eddy loses, after which Harry gives him a week to pay back 500,000 pounds."
622,/mnt/data/guest0/uchan/DATA/Sex Education,3,2,3,1,2,A teenage boy with a sex therapist mother teams up with a high school classmate to set up an underground sex therapy clinic at school.
765,/mnt/data/guest0/uchan/DATA/Ugly Betty,2,2,2,2,2,Smart but wholesome Betty embraces her unique appearance and independent attitude in the cutthroat world of New York fashion.
1778,/mnt/data/guest0/uchan/DATA/The Devil All the Time,1,3,1,2,3,Sinister characters converge around a young man devoted to protecting those he loves in a postwar backwoods town teeming with corruption and brutality.
1504,/mnt/data/guest0/uchan/DATA/Way Down,0,1,1,2,1,"Thom, a genius engineering graduate is interested in the Bank of Spain's safe. The Bank building is more than 100 years old, with no building blueprints available and a security system that includes an underground river that will flood the safe room if their walls are breached. As soon as Thom learns that a legendary lost treasure is going to be held at the bank's safe for just 10 days, he devises, together with charismatic art dealer Walter ""Cunningham"" a detailed plan to breaking in. They will only have 105 minutes to do so, while the Bank's staff will be distracted, watching the 2010 Football World Cup final match , played by Spain's national football team and broadcast on a giant screen, coincidentally placed just in front of the Bank of Spain building."
1685,/mnt/data/guest0/uchan/DATA/Safe Haven,2,2,2,2,1,"A young woman with a mysterious past lands in Southport, North Carolina where her bond with a widower forces her to confront the dark secret that haunts her."
1020,/mnt/data/guest0/uchan/DATA/The Nun,0,3,2,0,3,A priest with a haunted past and a novice on the threshold of her final vows are sent by the Vatican to investigate the death of a young nun in Romania and confront a malevolent force in the form of a demonic nun.
303,/mnt/data/guest0/uchan/DATA/Banshee,3,3,3,1,3,"An ex-con assumes the identity of a murdered sheriff in the small town of Banshee, Pennsylvania; where he has some unfinished business."
1328,/mnt/data/guest0/uchan/DATA/Doom Patrol,1,3,3,2,1,The adventures of an idealistic mad scientist and his field team of superpowered outcasts.
1745,/mnt/data/guest0/uchan/DATA/Green Book,2,2,1,1,2,A working-class Italian-American bouncer becomes the driver of an African-American classical pianist on a tour of venues through the 1960s American South.
303,/mnt/data/guest0/uchan/DATA/The Twilight Zone,0,2,2,2,1,"Ordinary people find themselves in extraordinarily astounding situations, which they each try to solve in a remarkable manner."
1252,/mnt/data/guest0/uchan/DATA/Pet Sematary,2,3,1,2,3,"Dr. Louis Creed and his wife, Rachel, relocate from Boston to rural Maine with their two young children. The couple soon discover a mysterious burial ground hidden deep in the woods near their new home."
1285,/mnt/data/guest0/uchan/DATA/Westworld,3,3,3,1,1,"Set at the intersection of the near future and the reimagined past, explore a world in which every human appetite can be indulged without consequence."
1746,/mnt/data/guest0/uchan/DATA/Guardians of the Galaxy,2,1,1,2,2,A group of intergalactic criminals must pull together to stop a fanatical warrior with plans to purge the universe.
1285,/mnt/data/guest0/uchan/DATA/Sin City,1,3,1,1,3,"A movie that explores the dark and miserable town, Basin City, tells the story of three different people, all caught up in violent corruption."
1784,/mnt/data/guest0/uchan/DATA/Casino Royale,1,1,2,2,1,"After earning 00 status and a licence to kill, Secret Agent James Bond sets out on his first mission as 007. Bond must defeat a private banker funding terrorists in a high-stakes game of poker at Casino Royale, Montenegro."
1343,/mnt/data/guest0/uchan/DATA/Office Space,2,0,1,2,0,Three company workers who hate their jobs decide to rebel against their greedy boss.
136,/mnt/data/guest0/uchan/DATA/Dragon Ball Z,2,1,2,2,1,"After learning that he is from another planet, a warrior named Goku and his friends are prompted to defend it from an onslaught of extraterrestrial enemies."
918,/mnt/data/guest0/uchan/DATA/Malèna,3,1,3,2,2,"Amidst the war climate, a teenage boy discovering himself becomes love-stricken by Malèna, a sensual woman living in a small, narrow-minded Italian town."
191,/mnt/data/guest0/uchan/DATA/Glee,2,0,2,2,0,A group of ambitious misfits try to escape the harsh realities of high school by joining a glee club headed by a passionate Spanish teacher.
662,/mnt/data/guest0/uchan/DATA/New Girl,1,0,2,2,0,"After a bad break-up, Jess, an offbeat young woman, moves into an apartment loft with three single men. Although they find her behavior very unusual, the men support her - most of the time."
1727,/mnt/data/guest0/uchan/DATA/Ready Player One,2,1,1,0,2,"When the creator of a virtual reality called the OASIS dies, he makes a posthumous challenge to all OASIS users to find his Easter Egg, which will give the finder his fortune and control of his world."
1205,/mnt/data/guest0/uchan/DATA/Scooby-Doo,2,2,2,2,2,"After an acrimonious break up, the Mystery Inc. gang are individually brought to an island resort to investigate strange goings on."
1354,/mnt/data/guest0/uchan/DATA/Cast Away,0,1,2,0,1,A FedEx executive undergoes a physical and emotional transformation after crash landing on a deserted island.
1572,/mnt/data/guest0/uchan/DATA/After Life,0,2,3,1,0,"After Tony's wife dies unexpectedly, his nice-guy persona is altered into an impulsive, devil-may-care attitude; taking his old world by storm."
664,/mnt/data/guest0/uchan/DATA/Superman and Lois,0,2,0,2,2,"Follow the world's most famous super hero and comic books' most famous journalist as they deal with all the stress, pressures, and complexities that come with being working parents in today's society."
684,/mnt/data/guest0/uchan/DATA/Boy Meets World,2,2,2,2,2,An adolescent with two siblings tests his various theories about life as he endures the trials of growing up alongside a good friend.
1308,/mnt/data/guest0/uchan/DATA/A Discovery of Witches,2,1,2,2,1,"Diana Bishop, historian and witch, accesses Ashmole 782 and knows she must solve its mysteries. She is offered help by the enigmatic Matthew Clairmont, but he's a vampire and witches should never trust vampires."
139,/mnt/data/guest0/uchan/DATA/Grimm,2,3,2,2,1,A homicide detective discovers he is a descendant of hunters who fight supernatural forces.
2070,/mnt/data/guest0/uchan/DATA/Justice League,2,1,2,2,2,"Fueled by his restored faith in humanity and inspired by Superman's selfless act, Bruce Wayne enlists the help of his new-found ally, Diana Prince, to face an even greater enemy."
1211,/mnt/data/guest0/uchan/DATA/Before Sunrise,2,0,2,2,0,"A young man and woman meet on a train in Europe, and wind up spending one evening together in Vienna. Unfortunately, both know that this will probably be their only night together."
1668,/mnt/data/guest0/uchan/DATA/Moana,0,2,0,0,2,"In Ancient Polynesia, when a terrible curse incurred by the Demigod Maui reaches Moana's island, she answers the Ocean's call to seek out the Demigod to set things right."
1696,/mnt/data/guest0/uchan/DATA/Homeland,3,1,1,2,1,A bipolar CIA operative becomes convinced a prisoner of war has been turned by al-Qaeda and is planning to carry out a terrorist attack on American soil.
1723,/mnt/data/guest0/uchan/DATA/A Time to Kill,1,1,1,2,3,"In Canton, Mississippi, a fearless young lawyer and his assistant defend a black man accused of murdering two white men who raped his ten-year-old daughter, inciting violent retribution and revenge from the Ku Klux Klan."
1885,/mnt/data/guest0/uchan/DATA/Legend,0,2,2,0,2,A young man must stop the Lord of Darkness from destroying daylight and marrying the woman he loves.
1133,/mnt/data/guest0/uchan/DATA/Haikyuu!!,0,0,2,2,0,"Determined to be like the volleyball championship's star player Shouyou, a short boy nicknamed ""the small giant,"" joins his school's volleyball club."
3732,/mnt/data/guest0/uchan/DATA/Young Sheldon,2,0,2,2,0,Meet a child genius named Sheldon Cooper; (already seen as an adult in The Big Bang Theory (2007)) and his family. Some unique challenges face Sheldon who seems socially impaired.
1258,/mnt/data/guest0/uchan/DATA/Flora & Ulysses,0,2,0,0,2,The adventures of a young girl and a squirrel with superpowers.
1041,/mnt/data/guest0/uchan/DATA/The Handmaid's Tale,3,3,1,2,3,"Set in a dystopian future, a woman is forced to live as a concubine under a fundamentalist theocratic dictatorship."
1673,/mnt/data/guest0/uchan/DATA/Joker,2,3,1,1,3,"In Gotham City, mentally troubled comedian Arthur Fleck is disregarded and mistreated by society. He then embarks on a downward spiral of revolution and bloody crime. This path brings him face-to-face with his alter-ego: the Joker."
1719,/mnt/data/guest0/uchan/DATA/Outer Banks,2,2,1,1,1,A group of teenagers from the wrong side of the tracks stumble upon a treasure map that unearths a long buried secret.
130,/mnt/data/guest0/uchan/DATA/Agent Carter,0,1,2,2,1,"In 1946, Peggy Carter is relegated to secretarial duties in the Strategic Scientific Reserve (SSR). When Howard Stark is accused of treason, he secretly recruits Peggy to clear his name with the help of his butler, Edwin Jarvis."
1759,/mnt/data/guest0/uchan/DATA/Escape from Pretoria,2,2,2,0,1,"Based on the real-life prison break of two political captives, Escape From Pretoria is a race-against-time thriller set in the tumultuous apartheid days of South Africa."
303,/mnt/data/guest0/uchan/DATA/It's a Sin,3,2,1,1,1,"A chronicle of four friends during a decade in which everything changed, including the rise of AIDS."
674,/mnt/data/guest0/uchan/DATA/Sons of Anarchy,1,3,1,3,3,A biker struggles to balance being a father and being involved in an outlaw motorcycle club.
912,/mnt/data/guest0/uchan/DATA/Pulp Fiction,1,3,3,3,1,"The lives of two mob hitmen, a boxer, a gangster and his wife, and a pair of diner bandits intertwine in four tales of violence and redemption."
750,/mnt/data/guest0/uchan/DATA/Cannibal Holocaust,3,3,1,1,3,"During a rescue mission into the Amazon rainforest, a professor stumbles across lost film shot by a missing documentary crew."
1673,/mnt/data/guest0/uchan/DATA/Narcos,3,3,3,3,3,"A chronicled look at the criminal exploits of Colombian drug lord Pablo Escobar, as well as the many other drug kingpins who plagued the country through the years."
579,"/mnt/data/guest0/uchan/DATA/Beverly Hills, 90210",2,2,2,1,1,"A group of friends living in Beverly Hills, California make their way through life from their school days into adulthood."
2746,/mnt/data/guest0/uchan/DATA/Forrest Gump,1,1,1,1,1,"The presidencies of Kennedy and Johnson, the Vietnam War, the Watergate scandal and other historical events unfold from the perspective of an Alabama man with an IQ of 75, whose only desire is to be reunited with his childhood sweetheart."
785,/mnt/data/guest0/uchan/DATA/Knives Out,0,2,1,2,2,"A detective investigates the death of a patriarch of an eccentric, combative family."
1244,/mnt/data/guest0/uchan/DATA/El hoyo,1,3,2,2,3,A vertical prison with one cell per level. Two people per cell. Only one food platform and two minutes per day to feed. An endless nightmare trapped in The Hole.
327,/mnt/data/guest0/uchan/DATA/Grease,2,2,2,2,0,"Good girl Sandy Olsson and greaser Danny Zuko fell in love over the summer. When they unexpectedly discover they're now in the same high school, will they be able to rekindle their romance?"
1884,/mnt/data/guest0/uchan/DATA/To All the Boys Always and Forever,2,0,2,0,0,Senior year of high school takes center stage as Lara Jean returns from a family trip to Korea and considers her college plans - with and without Peter.
498,/mnt/data/guest0/uchan/DATA/24,2,1,2,2,1,Jack Bauer races against the clock to subvert terrorist plots and save his nation from ultimate disaster.
1023,/mnt/data/guest0/uchan/DATA/Harrow,1,1,1,2,1,"Harrow tells the story of Dr. Daniel Harrow, a forensic pathologist with a total disregard for authority."
1024,/mnt/data/guest0/uchan/DATA/Schitt's Creek,2,0,1,2,0,"When rich video-store magnate Johnny Rose and his family suddenly find themselves broke, they are forced to leave their pampered lives to regroup in Schitt's Creek."
1307,/mnt/data/guest0/uchan/DATA/Atypical,2,0,2,2,2,"Sam, an 18-year-old on the autism spectrum, decides it's time to find a girlfriend, a journey that sets Sam's mom on her own life-changing path as her son seeks more independence."
1757,/mnt/data/guest0/uchan/DATA/Zodiac,2,1,1,1,3,"In the late 1960s/early 1970s, a San Francisco cartoonist becomes an amateur detective obsessed with tracking down the Zodiac Killer, an unidentified individual who terrorizes Northern California with a killing spree."
547,/mnt/data/guest0/uchan/DATA/The Secret Life of Pets 2,0,2,2,0,2,"Continuing the story of Max and his pet friends, following their secret lives after their owners leave them for work or school each day."
4387,/mnt/data/guest0/uchan/DATA/There's Something About Mary,1,2,1,2,0,"A man gets a chance to meet up with his dream girl from high school, even though his date with her back then was a complete disaster."
339,/mnt/data/guest0/uchan/DATA/Hot Fuzz,2,3,3,2,1,A skilled London police officer is transferred to a small town with a dark secret.
1068,/mnt/data/guest0/uchan/DATA/Wynonna Earp,2,1,2,1,1,"Following Wyatt Earp's great great-granddaughter as she battles demons and other creatures. With her unique abilities and a posse of dysfunctional allies, she's the only thing that can bring the paranormal to justice."
1554,/mnt/data/guest0/uchan/DATA/Harry Potter and the Goblet of Fire,0,1,2,2,1,"Harry Potter finds himself competing in a hazardous tournament between rival schools of magic, but he is distracted by recurring nightmares."
1832,/mnt/data/guest0/uchan/DATA/Wanbyeokhan geunyeo ege dak hangaji eobtneun geot,2,0,2,2,0,"A girl makes a wish on her thirteenth birthday, and wakes up the next day as a thirty-year-old woman."
1402,/mnt/data/guest0/uchan/DATA/The Serpent,2,1,1,1,1,"The twisting, real-life story of Charles Sobhraj, a murderer, thief and seductive master of disguise, who was a hidden darkness in the mid-70's on Asia's hippie trail."
303,/mnt/data/guest0/uchan/DATA/Coming 2 America,1,0,1,2,0,The African monarch Akeem learns he has a long-lost son in the United States and must return to America to meet this unexpected heir and build a relationship with his son.
1414,/mnt/data/guest0/uchan/DATA/Jessica Jones,1,1,1,1,1,"Following the tragic end of her brief superhero career, Jessica Jones tries to rebuild her life as a private investigator, dealing with cases involving people with remarkable abilities in New York City."
1756,/mnt/data/guest0/uchan/DATA/Bridesmaids,1,2,3,2,0,"Competition between the maid of honor and a bridesmaid, over who is the bride's best friend, threatens to upend the life of an out-of-work pastry chef."
1751,/mnt/data/guest0/uchan/DATA/Oblivion,2,1,1,2,2,A veteran assigned to extract Earth's remaining resources begins to question what he knows about his mission and himself.
1907,/mnt/data/guest0/uchan/DATA/The Invisible Man,0,3,1,2,3,"When Cecilia's abusive ex takes his own life and leaves her his fortune, she suspects his death was a hoax. As a series of coincidences turn lethal, Cecilia works to prove that she is being hunted by someone nobody can see."
1769,/mnt/data/guest0/uchan/DATA/Enchanted,2,2,0,0,2,"A young maiden in a land called Andalasia, who is prepared to be wed, is sent away to New York City by an evil Queen, where she falls in love with a lawyer."
1327,/mnt/data/guest0/uchan/DATA/White House Farm,2,2,1,2,1,"Revolves around the true story of a fateful night in August 1985 when five members of the same family are murdered at an Essex farmhouse, and the ensuing police investigation and court case that follows."
765,/mnt/data/guest0/uchan/DATA/The King of Queens,2,0,2,2,0,"Delivery man Doug Heffernan has a good life: He has a pretty wife (Carrie), a big television, and friends with which to watch it. Then Carrie's goofy and annoying father Arthur moves in with them."
1479,/mnt/data/guest0/uchan/DATA/After We Collided,1,2,1,1,2,"Based on the 2014 romance novel of the same name, this follows the love life of two young adults."
1424,/mnt/data/guest0/uchan/DATA/Supernova,2,2,1,2,2,"Sam and Tusker are traveling across England in their old RV to visit friends, family and places from their past. Since Tusker was diagnosed with dementia two years ago, their time together is the most important thing they have."
