1849,/mnt/data/guest0/uchan/DATA/Mamma Mia! Here We Go Again,2,0,0,2,0,"Five years after the events of Mamma Mia! (2008), Sophie prepares for the grand reopening of the Hotel Bella Donna as she learns more about her mother's past."
708,/mnt/data/guest0/uchan/DATA/The Originals,2,1,2,2,1,A family of power-hungry thousand-year-old vampires look to take back the city that they built and dominate all those who have done them wrong.
945,/mnt/data/guest0/uchan/DATA/A Bug's Life,0,2,0,2,2,"A misfit ant, looking for ""warriors"" to save his colony from greedy grasshoppers, recruits a group of bugs that turn out to be an inept circus troupe."
303,/mnt/data/guest0/uchan/DATA/The Sinner,1,1,1,1,3,Anthology series that examines how and why ordinary people commit brutal crimes.
548,/mnt/data/guest0/uchan/DATA/The New Mutants,2,1,1,2,1,"Five young mutants, just discovering their abilities while held in a secret facility against their will, fight to escape their past sins and save themselves."
469,/mnt/data/guest0/uchan/DATA/Monk,2,2,2,2,2,"The series follows Adrian Monk, a brilliant former San Francisco detective, who now consults the police as a private consultant who battles with an obsessive-compulsive disorder."
303,/mnt/data/guest0/uchan/DATA/Endeavour,2,1,2,2,2,"Set in the 1960s, the show follows Endeavour Morse in his early years as a police constable. Working alongside his senior partner DI Fred Thursday, Morse engages in a number of investigations around Oxford."
1595,/mnt/data/guest0/uchan/DATA/Star Trek Voyager,0,2,0,2,1,"Pulled to the far side of the galaxy, where the Federation is seventy-five years away at maximum warp speed, a Starfleet ship must cooperate with Maquis rebels to find a way home."
1174,/mnt/data/guest0/uchan/DATA/Revenge,2,1,2,1,1,An emotionally troubled young woman sets out to exact revenge against the people who wronged her father.
1708,/mnt/data/guest0/uchan/DATA/Rushmore,2,2,1,2,0,The extracurricular king of Rushmore Preparatory School is put on academic probation.
1633,/mnt/data/guest0/uchan/DATA/The Girl Next Door,3,3,3,1,3,Follows the unspeakable torture and abuses committed on a teenage girl in the care of her aunt and the boys who witness and fail to report the crime.
1406,/mnt/data/guest0/uchan/DATA/Snatch,2,1,3,2,2,"Unscrupulous boxing promoters, violent bookmakers, a Russian gangster, incompetent amateur robbers and supposedly Jewish jewelers fight to track down a priceless stolen diamond."
1769,/mnt/data/guest0/uchan/DATA/The Maze Runner,0,1,2,2,1,"Thomas is deposited in a community of boys after his memory is erased, soon learning they're all trapped in a maze that will require him to join forces with fellow ""runners"" for a shot at escape."
663,/mnt/data/guest0/uchan/DATA/Poldark,2,2,2,2,2,"Ross Poldark returns home after American Revolutionary War and rebuilds his life with a new business venture, making new enemies and finding a new love where he least expects it."
114,/mnt/data/guest0/uchan/DATA/Final Space,2,1,2,2,1,An astronaut named Gary and his planet-destroying sidekick called Mooncake embark on serialized journeys through space in order to unlock the mystery of where the universe actually ends and if it actually does exist.
1758,/mnt/data/guest0/uchan/DATA/Closer,1,2,3,2,0,The relationships of two couples become complicated and deceitful when the man from one couple meets the woman of the other.
1469,/mnt/data/guest0/uchan/DATA/Grown Ups,2,2,2,2,0,"After their high school basketball coach passes away, five good friends and former teammates reunite for a Fourth of July holiday weekend."
1692,/mnt/data/guest0/uchan/DATA/Supergirl,2,2,2,2,2,The adventures of Superman's cousin in her own superhero career.
1419,/mnt/data/guest0/uchan/DATA/Warrior,3,3,3,1,1,"During the Tong Wars in the late 1800s, Ah Sahm, a martial arts prodigy from China, immigrates to San Francisco and becomes a hatchet man for the most powerful tong in Chinatown."
1353,/mnt/data/guest0/uchan/DATA/Silicon Valley,2,2,3,1,0,"Follows the struggle of Richard Hendricks, a Silicon Valley engineer trying to build his own company called Pied Piper."
1322,/mnt/data/guest0/uchan/DATA/Dark Phoenix,0,1,1,2,1,"Jean Grey begins to develop incredible powers that corrupt and turn her into a Dark Phoenix, causing the X-Men to decide if her life is worth more than all of humanity."
1945,/mnt/data/guest0/uchan/DATA/Frasier,2,0,2,2,0,"Dr. Frasier Crane moves back to his hometown of Seattle, where he lives with his father, and works as a radio psychiatrist."
159,/mnt/data/guest0/uchan/DATA/Akelarre,1,1,1,2,1,"Basque Country, 1609. The men of the region are at sea and Amaia takes part for the first time in the nightly dances in the woods with the other villager girls. She is only 20. At dawn, they are all arrested."
320,/mnt/data/guest0/uchan/DATA/Harry Potter and the Sorcerer's Stone,0,2,2,0,2,"An orphaned boy enrolls in a school of wizardry, where he learns the truth about himself, his family and the terrible evil that haunts the magical world."
1671,/mnt/data/guest0/uchan/DATA/Wedding Crashers,1,2,1,2,0,"John Beckwith and Jeremy Grey, a pair of committed womanizers who sneak into weddings to take advantage of the romantic tinge in the air, find themselves at odds with one another when John meets and falls for Claire Cleary."
1261,/mnt/data/guest0/uchan/DATA/Parker,1,3,3,2,1,"A thief with a unique code of professional ethics is double-crossed by his crew and left for dead. Assuming a new disguise and forming an unlikely alliance with a woman on the inside, he looks to hijack the score of the crew's latest heist."
2255,/mnt/data/guest0/uchan/DATA/Edward Scissorhands,2,1,2,2,1,"An artificial man, who was incompletely constructed and has scissors for hands, leads a solitary life. Then one day, a suburban lady meets him and introduces him to her world."
1777,/mnt/data/guest0/uchan/DATA/Fargo,2,3,1,2,3,"Various chronicles of deception, intrigue and murder in and around frozen Minnesota. Yet all of these tales mysteriously lead back one way or another to Fargo, North Dakota."
1167,/mnt/data/guest0/uchan/DATA/Girls,3,2,3,1,2,A comedy about the experiences of a group of girls in their early 20s.
665,/mnt/data/guest0/uchan/DATA/Fear the Walking Dead,2,3,2,2,3,"A Walking Dead spin-off, set in Los Angeles, following two families who must band together to survive the undead apocalypse."
1536,/mnt/data/guest0/uchan/DATA/Iron Fist,2,3,2,1,2,A young man is bestowed with incredible martial arts skills and a mystical force known as the Iron Fist.
1763,/mnt/data/guest0/uchan/DATA/Catch Me If You Can,1,2,1,2,2,"Barely 21 yet, Frank is a skilled forger who has passed as a doctor, lawyer and pilot. FBI agent Carl becomes obsessed with tracking down the con man, who only revels in the pursuit."
1258,/mnt/data/guest0/uchan/DATA/Loco por ella,2,0,0,1,0,"After a magical night together, Adri voluntarily turns himself into the psychiatric institution where Carla lives."
1032,/mnt/data/guest0/uchan/DATA/One Piece Wan pîsu,2,1,2,1,1,"Follows the adventures of Monkey D. Luffy and his pirate crew in order to find the greatest treasure ever left by the legendary Pirate, Gold Roger. The famous mystery treasure named ""One Piece""."
1222,/mnt/data/guest0/uchan/DATA/Hotaru no haka,0,1,2,2,3,A young boy and his little sister struggle to survive in Japan during World War II.
2186,/mnt/data/guest0/uchan/DATA/48 Hrs,1,1,3,1,1,"A hard-nosed cop reluctantly teams up with a wise-cracking criminal temporarily paroled to him, in order to track down a killer."
2585,/mnt/data/guest0/uchan/DATA/Amélie,1,2,0,2,0,"Amélie is an innocent and naive girl in Paris with her own sense of justice. She decides to help those around her and, along the way, discovers love."
1520,/mnt/data/guest0/uchan/DATA/Possessor,3,3,1,1,3,Possessor follows an agent who works for a secretive organization that uses brain-implant technology to inhabit other people's bodies - ultimately driving them to commit assassinations for high-paying clients.
695,/mnt/data/guest0/uchan/DATA/Sky Rojo,3,3,2,1,1,"Coral, Wendy and Gina go on the run in search of freedom while being chased by Romeo, their pimp from Las Novias Club, and his henchmen, Moises and Christian."
1893,/mnt/data/guest0/uchan/DATA/I Am Legend,0,1,2,0,1,"Years after a plague kills most of humanity and transforms the rest into monsters, the sole survivor in New York City struggles valiantly to find a cure."
1769,/mnt/data/guest0/uchan/DATA/Juno,1,2,1,2,0,"Faced with an unplanned pregnancy, an offbeat young woman makes an unusual decision regarding the unborn child."
123,/mnt/data/guest0/uchan/DATA/Frozen II,0,2,0,0,2,"Anna, Elsa, Kristoff, Olaf and Sven leave Arendelle to travel to an ancient, autumn-bound forest of an enchanted land. They set out to find the origin of Elsa's powers in order to save their kingdom."
1300,/mnt/data/guest0/uchan/DATA/A Shaun the Sheep Movie Farmageddon,0,2,0,0,2,"When an alien with amazing powers crash-lands near Mossy Bottom Farm, Shaun the Sheep goes on a mission to shepherd the intergalactic visitor home before a sinister organization can capture her."
472,/mnt/data/guest0/uchan/DATA/Condor,1,1,1,2,2,"A brilliant, young, idealistic CIA analyst finds himself in the middle of a conspiracy that kills everyone else at his office. Can he, with no field experience, stay alive long enough to get to the bottom of it?"
1377,/mnt/data/guest0/uchan/DATA/Fantastic Mr. Fox,0,2,2,2,2,An urbane fox cannot resist returning to his farm raiding ways and then must help his community survive the farmers' retaliation.
1739,/mnt/data/guest0/uchan/DATA/John Wick Chapter 3 - Parabellum,0,3,1,2,3,"John Wick is on the run after killing a member of the international assassins' guild, and with a $14 million price tag on his head, he is the target of hit men and women everywhere."
1892,/mnt/data/guest0/uchan/DATA/Palm Springs,1,2,3,1,0,"Stuck in a time loop, two wedding guests develop a budding romance while living the same day over and over again."
1637,/mnt/data/guest0/uchan/DATA/A Knight's Tale,2,2,2,2,2,"After his master dies, a peasant squire, fueled by his desire for food and glory, creates a new identity for himself as a knight."
1567,/mnt/data/guest0/uchan/DATA/Phantom Thread,2,0,1,2,2,"Set in 1950s London, Reynolds Woodcock is a renowned dressmaker whose fastidious life is disrupted by a young, strong-willed woman, Alma, who becomes his muse and lover."
827,/mnt/data/guest0/uchan/DATA/The Office,2,0,2,2,0,"A mockumentary on a group of typical office workers, where the workday consists of ego clashes, inappropriate behavior, and tedium."
160,/mnt/data/guest0/uchan/DATA/Outlander,3,3,1,2,1,An English combat nurse from 1945 is mysteriously swept back in time to 1743.
303,/mnt/data/guest0/uchan/DATA/The Midnight Sky,0,2,2,2,2,"This post-apocalyptic tale follows Augustine, a lonely scientist in the Arctic, as he races to stop Sully and her fellow astronauts from returning home to a mysterious global catastrophe."
2177,/mnt/data/guest0/uchan/DATA/Taxi Driver,1,3,3,1,3,"A mentally unstable veteran works as a nighttime taxi driver in New York City, where the perceived decadence and sleaze fuels his urge for violent action by attempting to liberate a presidential campaign worker and an underage prostitute."
1774,/mnt/data/guest0/uchan/DATA/Enola Holmes,0,2,0,2,2,"When Enola Holmes-Sherlock's teen sister-discovers her mother missing, she sets off to find her, becoming a super-sleuth in her own right as she outwits her famous brother and unravels a dangerous conspiracy around a mysterious young Lord."
1849,/mnt/data/guest0/uchan/DATA/Over the Moon,0,0,0,0,2,"In this animated musical, a girl builds a rocket ship and blasts off, hoping to meet a mythical moon goddess."
1709,/mnt/data/guest0/uchan/DATA/Interstellar,0,2,2,0,1,A team of explorers travel through a wormhole in space in an attempt to ensure humanity's survival.
1243,/mnt/data/guest0/uchan/DATA/Resident Alien,2,2,1,2,2,It follows a crash-landed alien named Harry who takes on the identity of a small-town Colorado doctor and slowly begins to wrestle with the moral dilemma of his secret mission on Earth.
303,/mnt/data/guest0/uchan/DATA/Dunkirk,0,1,1,2,3,"Allied soldiers from Belgium, the British Empire, and France are surrounded by the German Army and evacuated during a fierce battle in World War II."
661,/mnt/data/guest0/uchan/DATA/Girl in the Basement,1,1,0,0,2,"Sara is a teen girl who is looking forward to her 18th birthday to move away from her controlling father Don. But before she could even blow out the candles, Don imprisons her in the basement of their home."
303,/mnt/data/guest0/uchan/DATA/The Flight Attendant,2,1,1,3,2,"A reckless flight attendant with an alcoholism problem wakes up in the wrong hotel, in the wrong bed, with a dead man - and no idea what happened. Unable to piece the night together, she begins to wonder if she could be the killer."
685,/mnt/data/guest0/uchan/DATA/The Avengers,0,1,2,2,2,Earth's mightiest heroes must come together and learn to fight as a team if they are going to stop the mischievous Loki and his alien army from enslaving humanity.
627,/mnt/data/guest0/uchan/DATA/Big Mouth,3,2,3,2,0,Teenage friends find their lives upended by the wonders and horrors of puberty.
1144,/mnt/data/guest0/uchan/DATA/Letterkenny,2,2,3,3,0,"Quick-witted, fast-paced snappy comedy about rural folk getting by in a small town."
415,/mnt/data/guest0/uchan/DATA/La casa de papel,1,1,1,2,1,An unusual group of robbers attempt to carry out the most perfect robbery in Spanish history - stealing 2.4 billion euros from the Royal Mint of Spain.
1496,/mnt/data/guest0/uchan/DATA/Dickinson,2,0,2,1,0,An inside look at the world of writer Emily Dickinson.
123,/mnt/data/guest0/uchan/DATA/It Chapter Two,2,3,3,2,3,"Twenty-seven years after their first encounter with the terrifying Pennywise, the Losers Club have grown up and moved away, until a devastating phone call brings them back."
1530,/mnt/data/guest0/uchan/DATA/Veronica Mars,2,2,2,1,1,"After her best friend is murdered, and her father is removed as county Sheriff, Veronica Mars dedicates her life to cracking the toughest mysteries in the affluent town of Neptune."
1732,/mnt/data/guest0/uchan/DATA/The Informer,0,3,3,1,1,An ex-convict working undercover intentionally gets himself incarcerated again in order to infiltrate the mob at a maximum security prison.
674,/mnt/data/guest0/uchan/DATA/Doc Martin,2,2,2,2,2,"The trials and tribulations of Dr. Martin Ellingham (Martin Clunes), a socially challenged doctor who moves from London to the picturesque village of Port Wenn in Cornwall."
1676,/mnt/data/guest0/uchan/DATA/Sing,0,2,0,2,2,"In a city of humanoid animals, a hustling theater impresario's attempt to save his theater with a singing competition becomes grander than he anticipates even as its finalists find that their lives will never be the same."
1105,/mnt/data/guest0/uchan/DATA/Brave New World,3,1,1,1,2,"In a utopia whose perfection hinges upon control of monogamy and privacy, members of the collective begin to question the rules, putting their regimented society on a collision course with forbidden love and revolution."
1371,/mnt/data/guest0/uchan/DATA/Joahamyeon Ullineun,0,1,2,2,1,"In a world where an app alerts people if someone in the vicinity likes them, Kim Jojo experiences young love while coping with personal adversities."
1075,/mnt/data/guest0/uchan/DATA/The Lobster,1,1,1,2,1,"In a dystopian near future, single people, according to the laws of The City, are taken to The Hotel, where they are obliged to find a romantic partner in forty-five days or are transformed into beasts and sent off into The Woods."
1287,/mnt/data/guest0/uchan/DATA/After,1,2,2,1,2,A young woman falls for a guy with a dark secret and the two embark on a rocky relationship. Based on the novel by Anna Todd.
638,/mnt/data/guest0/uchan/DATA/Psych,2,2,2,2,2,"A novice sleuth is hired by the Police after he cons them into thinking he has psychic powers which help solve crimes. With the assistance of his reluctant best friend, the duo take on a series of complicated cases."
1916,/mnt/data/guest0/uchan/DATA/Bridgerton,3,2,2,2,2,"Wealth, lust, and betrayal set against the backdrop of Regency-era England, seen through the eyes of the powerful Bridgerton family."
664,/mnt/data/guest0/uchan/DATA/Fifty Shades Freed,3,1,1,2,2,"Anastasia and Christian get married, but Jack Hyde continues to threaten their relationship."
663,/mnt/data/guest0/uchan/DATA/Queen of the South,2,3,3,3,3,Teresa flees Mexico after her drug-runner boyfriend is murdered. Settling in Dallas she looks to become the country's reigning drug smuggler and to avenge her lover's murder.
287,/mnt/data/guest0/uchan/DATA/Can't Hardly Wait,2,0,1,3,0,"A complete graduating class, consisting of beautiful girls, geeks and promising footballers, assemble at a rich classmate's residence for a party. Interesting developments follow at the get-together."
1468,/mnt/data/guest0/uchan/DATA/Peter Pan,0,1,0,2,1,"The Darling family children receive a visit from Peter Pan, who takes them to Never Never Land where an ongoing war with the evil Pirate Captain Hook is taking place."
1751,/mnt/data/guest0/uchan/DATA/Rock of Ages,1,2,1,1,0,A small-town girl and a city boy meet on the Sunset Strip while pursuing their Hollywood dreams.
1632,/mnt/data/guest0/uchan/DATA/Guardians of the Galaxy Vol. 2,2,1,2,2,1,"The Guardians struggle to keep together as a team while dealing with their personal family issues, notably Star-Lord's encounter with his father the ambitious celestial being Ego."
1057,/mnt/data/guest0/uchan/DATA/Porky's,1,2,1,2,0,"In 1954, a group of Florida high-school guys try to help their buddy lose his virginity, which leads them to seek revenge on a sleazy nightclub owner and his redneck sheriff brother for harassing them."
1476,/mnt/data/guest0/uchan/DATA/Harley Quinn,2,3,3,1,1,"The series focuses on a single Harley Quinn, who sets off to make it on her own in Gotham City."
708,/mnt/data/guest0/uchan/DATA/Law & Order,2,1,2,1,1,"Follows a crime (usually a murder), usually adapted from current headlines, from two separate vantage points, the police investigation and the prosecution in court."
1081,/mnt/data/guest0/uchan/DATA/Ghost Busters,2,2,1,2,2,Three former parapsychology professors set up shop as a unique ghost removal service.
304,/mnt/data/guest0/uchan/DATA/Nobody,2,3,1,2,1,A bystander who intervenes to help a woman being harassed by a group of men becomes the target of a vengeful drug lord.
1771,/mnt/data/guest0/uchan/DATA/Up in the Air,1,0,1,2,0,"Ryan Bingham enjoys living out of a suitcase for his job, travelling around the country firing people, but finds that lifestyle threatened by the presence of a potential love interest, and a new hire presenting a new business model."
1621,/mnt/data/guest0/uchan/DATA/Friends,2,0,2,2,0,Follows the personal and professional lives of six twenty to thirty-something-year-old friends living in Manhattan.
3025,/mnt/data/guest0/uchan/DATA/Jane the Virgin,2,2,2,2,2,"A young, devout Catholic woman discovers that she was accidentally artificially inseminated."
763,/mnt/data/guest0/uchan/DATA/Sonic the Hedgehog,0,2,2,2,2,"After discovering a small, blue, fast hedgehog, a small-town police officer must help him defeat an evil genius who wants to do experiments on him."
1399,/mnt/data/guest0/uchan/DATA/The Rental,2,1,1,1,1,Two couples rent a vacation home for what should be a celebratory weekend get-away.
1827,/mnt/data/guest0/uchan/DATA/Atonement,1,1,1,2,1,Thirteen-year-old fledgling writer Briony Tallis irrevocably changes the course of several lives when she accuses her older sister's lover of a crime he did not commit.
1453,/mnt/data/guest0/uchan/DATA/Your Honor,2,3,2,2,3,"A judge confronts his convictions when his son is involved in a hit and run that embroils an organized crime family. Facing impossible choices, he discovers how far a father will go to save his son's life."
979,/mnt/data/guest0/uchan/DATA/Re Zero kara hajimeru isekai seikatsu,2,3,1,0,3,"Shortly after being summoned to a new world, Subaru Natsuki and his new female companion are brutally murdered. But then he awakes to find himself in the same alley, with the same thugs, the same girl, and the day begins to repeat."
1755,/mnt/data/guest0/uchan/DATA/No Country for Old Men,2,3,2,2,3,Violence and mayhem ensue after a hunter stumbles upon a drug deal gone wrong and more than two million dollars in cash near the Rio Grande.
1258,/mnt/data/guest0/uchan/DATA/Versailles,3,3,1,2,1,"In 1667, 28-year-old all-powerful king of France, Louis XIV, decides to build the greatest palace in the world - Versailles. But drained budget, affairs and political intrigues complicate things."
1455,"/mnt/data/guest0/uchan/DATA/Love, Victor",0,0,2,2,0,"Victor is a new student at Creekwood High School on his own journey of self-discovery, facing challenges at home, adjusting to a new city, and struggling with his sexual orientation."
483,/mnt/data/guest0/uchan/DATA/McLeod's Daughters,2,2,2,2,1,"Five women run a cattle station, ""Drover's Run"", in the outback of South Australia."
1270,/mnt/data/guest0/uchan/DATA/Valerian and the City of a Thousand Planets,2,2,2,0,2,"A dark force threatens Alpha, a vast metropolis and home to species from a thousand planets. Special operatives Valerian and Laureline must race to identify the marauding menace and safeguard not just Alpha, but the future of the universe."
1400,/mnt/data/guest0/uchan/DATA/Dawson's Creek,2,2,2,2,2,Four friends in a small coastal town help each other cope with adolescence.
1757,/mnt/data/guest0/uchan/DATA/The Hobbit An Unexpected Journey,0,1,0,2,1,"A reluctant Hobbit, Bilbo Baggins, sets out to the Lonely Mountain with a spirited group of dwarves to reclaim their mountain home, and the gold within it from the dragon Smaug."
1409,/mnt/data/guest0/uchan/DATA/Focus,1,1,3,2,2,"In the midst of veteran con man Nicky's latest scheme, a woman from his past - now an accomplished femme fatale - shows up and throws his plans for a loop."
1073,/mnt/data/guest0/uchan/DATA/The Hunger Games,0,1,2,2,1,Katniss Everdeen voluntarily takes her younger sister's place in the Hunger Games: a televised competition in which two teenagers from each of the twelve Districts of Panem are chosen at random to fight to the death.
1461,/mnt/data/guest0/uchan/DATA/Prison Break,2,1,2,2,1,"Due to a political conspiracy, an innocent man is sent to death row and his only hope is his brother, who makes it his mission to deliberately get himself sent to the same prison in order to break the both of them out, from the inside."
1755,/mnt/data/guest0/uchan/DATA/Rapunjel,0,2,0,2,2,"The magically long-haired Rapunzel has spent her entire life in a tower, but now that a runaway thief has stumbled upon her, she is about to discover the world for the first time, and who she really is."
1646,/mnt/data/guest0/uchan/DATA/Rifkin's Festival,2,2,2,2,2,"A married American couple go to the San Sebastian Festival and get caught up in the magic of the event, the beauty and charm of the city and the fantasy of movies."
1478,/mnt/data/guest0/uchan/DATA/The Silencing,2,1,2,1,1,A reformed hunter living in isolation on a wildlife sanctuary becomes involved in a deadly game of cat and mouse when he and the local Sheriff set out to track a vicious killer who may have kidnapped his daughter years ago.
3788,/mnt/data/guest0/uchan/DATA/Will & Grace,2,0,2,2,0,"Gay lawyer Will and straight interior designer Grace share a New York City apartment. Their best friends are gleeful and proud gay Jack and charismatic, filthy-rich, amoral socialite Karen."
1852,/mnt/data/guest0/uchan/DATA/We're the Millers,1,2,3,3,0,A veteran pot dealer creates a fake family as part of his plan to move a huge shipment of weed into the U.S. from Mexico.
1664,/mnt/data/guest0/uchan/DATA/Five Feet Apart,2,0,2,2,2,"A pair of teenagers with cystic fibrosis meet in a hospital and fall in love, though their disease means they must avoid close physical contact."
1303,/mnt/data/guest0/uchan/DATA/The Thing That Couldn't Die,0,2,0,2,1,"A psychically gifted young woman discovers a centuries-old crate buried on her aunt's ranch. Opening it, her family discovers the living head of Gideon Drew, a 16th century devil worshiper who was beheaded by Sir Francis Drake."
303,/mnt/data/guest0/uchan/DATA/City on a Hill,1,1,3,1,1,"In early 1990s Boston, ADA Decourcy Ward forms an unlikely alliance with a corrupt venerated FBI veteran, Jackie Rohr. Together, they take on a case that changes the city's entire criminal justice system."
1571,/mnt/data/guest0/uchan/DATA/Police Academy,1,2,1,2,0,"A group of good-hearted, but incompetent misfits enter the police academy, but the instructors there are not going to put up with their pranks."
977,/mnt/data/guest0/uchan/DATA/The Lighthouse,1,3,1,1,3,Two lighthouse keepers try to maintain their sanity while living on a remote and mysterious New England island in the 1890s.
1341,/mnt/data/guest0/uchan/DATA/Death Note Desu nôto,2,1,2,2,3,An intelligent high school student goes on a secret crusade to eliminate criminals from the world after discovering a notebook capable of killing anyone whose name is written into it.
1024,/mnt/data/guest0/uchan/DATA/American Horror Story,3,3,3,3,3,"An anthology series centering on different characters and locations, including a house with a murderous past, an insane asylum, a witch coven, a freak show circus, a haunted hotel, a possessed farmhouse, a cult, the apocalypse, and a slasher summer camp."
1029,/mnt/data/guest0/uchan/DATA/Gomorra La serie,1,3,3,3,3,Ciro disregards tradition in his attempt to become the next boss of his crime syndicate. The internal power struggle puts him and his entire family's life at risk.
